<!-- $Id: graphics.dtd,v 1.19 2004/12/08 06:51:52 steven-j-s Exp $ -->

<!ENTITY % bool '( true | false )'>
<!ENTITY % fixup '( none | intro | introExtended | abyss | abacus | dungns )'>
<!ENTITY % layouttype '( standard | gem )'>
<!ENTITY % transformtype '( invert | pixel | scroll | frame | pixel_color )'>
<!ENTITY % context '( frame | dir )'>

<!ELEMENT graphics ( imageset | layout | tileanimset )+ >

<!ELEMENT imageset ( image+ ) >
<!ATTLIST imageset name           NMTOKEN  #REQUIRED
                   extends        NMTOKEN  #IMPLIED>

<!ELEMENT image ( subimage* ) >
<!ATTLIST image name              NMTOKEN  #REQUIRED
                filename          CDATA    #REQUIRED
                width             NMTOKEN  #REQUIRED
                height            NMTOKEN  #REQUIRED
                depth             NMTOKEN  #REQUIRED
                prescale          NMTOKEN  #IMPLIED
                filetype          CDATA    #REQUIRED
                tiles             NMTOKEN  #IMPLIED
                introOnly         %bool;   #IMPLIED
                transparentIndex  NMTOKEN  #IMPLIED
                xu4Graphic        %bool;   #IMPLIED
                fixup             %fixup;  #IMPLIED>

<!ELEMENT subimage EMPTY >
<!ATTLIST subimage name           NMTOKEN  #REQUIRED
                   x              NMTOKEN  #IMPLIED
                   y              NMTOKEN  #IMPLIED
                   width          NMTOKEN  #REQUIRED
                   height         NMTOKEN  #REQUIRED>

<!ELEMENT layout ( tileshape, viewport ) >
<!ATTLIST layout name             CDATA    #REQUIRED
                 type             %layouttype; #REQUIRED>

<!ELEMENT tileshape EMPTY >
<!ATTLIST tileshape width         NMTOKEN  #REQUIRED
                    height        NMTOKEN  #REQUIRED>

<!ELEMENT viewport EMPTY >
<!ATTLIST viewport x              NMTOKEN  #REQUIRED
                   y              NMTOKEN  #REQUIRED
                   width          NMTOKEN  #REQUIRED
                   height         NMTOKEN  #REQUIRED>

<!ELEMENT tileanimset ( tileanim+ ) >
<!ATTLIST tileanimset name        NMTOKEN  #REQUIRED>

<!ELEMENT tileanim ( transform+ | context+ ) >
<!ATTLIST tileanim name           NMTOKEN  #REQUIRED
                   random         NMTOKEN  #IMPLIED>

<!ELEMENT context ( transform+ ) >
<!ATTLIST context type            %context; #REQUIRED
                  frame           NMTOKEN   #IMPLIED
                  dir             NMTOKEN   #IMPLIED>

<!ELEMENT transform ( color* ) >
<!ATTLIST transform type          %transformtype; #REQUIRED
                    x             NMTOKEN  #IMPLIED
                    y             NMTOKEN  #IMPLIED
                    width         NMTOKEN  #IMPLIED
                    height        NMTOKEN  #IMPLIED
                    random        NMTOKEN  #IMPLIED
                    increment     NMTOKEN  #IMPLIED>  <!-- If not provided, equals scale -->
